{
  "operation_id": "op-create-001",
  "actor_id": "owner-001",
  "role": "owner",
  "invocation_id": "owner-invocation-001",
  "case_id": "QMS-0001",
  "owner": "owner-001",
  "baseline": {
    "purpose": "対象成果物が合意済み要求を満たすことを確認する",
    "intended_use": {
      "users": "開発チーム・QA担当者",
      "environment": "ローカル検証環境",
      "operational_context": "機能リファクタリング後の品質確認"
    },
    "risk_context": {
      "criticality": "medium",
      "safety_impact": "なし",
      "data_integrity_impact": "低",
      "security_context": "内部利用ツール"
    },
    "requirements": [
      {"requirement_id": "REQ-001", "text": "期待される結果を再現できること"}
    ],
    "acceptance_criteria": ["REQ-001の確認Evidenceがあること"],
    "exclusions": [],
    "targets": ["artifact/example.txt"],
    "target_revision": "revision-1"
  },
  "implementation_authorization": {
    "allowed": false,
    "finding_ids": [],
    "allowed_targets": []
  },
  "change_observation": {
    "method": "finite-manifest",
    "scope": ["artifact/example.txt"],
    "baseline_evidence_id": null,
    "exclusions": [],
    "limitations": []
  }
}
